{
  "type": "snapshot_commitment",
  "version": "0.1",
  "snapshot_id": "snap_test_001",
  "ciphertext_hash": "sha256_test_hash_001",
  "owner_signing_public_key": "owner_test_signing_public_key_001",
  "owner_encryption_public_key": "owner_test_encryption_public_key_001",
  "capture_timestamp": "2026-05-15T00:00:00Z",
  "metadata_policy": {
    "location_public": false,
    "location_precision": "not_public",
    "media_type": "photo"
  },
  "session_nonce": "session_nonce_test_001",
  "owner_signature": "owner_test_signature_001"
}